{
  "schema": "ra.cli_surface_diff.v1",
  "generated_at": "2026-04-22T18:30:00Z",
  "pi_mono_baseline": {
    "commit": "10bca71fcfc2c4cb7bbbdb4110644a8c5aaef768",
    "version": "0.51.0"
  },
  "rust_pi_version": {
    "commit": "f1286b34",
    "version": "0.x.x-dev"
  },
  "flags": [
    {
      "name": "help",
      "short": "h",
      "takes_value": false,
      "optional_value": false,
      "default_value": null,
      "env_var": null,
      "description": "Print help information",
      "classification": "identical",
      "action": "MATCH",
      "notes": "Both implementations support help flag"
    },
    {
      "name": "version",
      "short": "v",
      "takes_value": false,
      "optional_value": false,
      "default_value": null,
      "env_var": null,
      "description": "Print version information",
      "classification": "identical",
      "action": "MATCH",
      "notes": "Both implementations support version flag"
    },
    {
      "name": "provider",
      "short": null,
      "takes_value": true,
      "optional_value": false,
      "default_value": null,
      "env_var": "RECUR_AGENT_PROVIDER",
      "description": "LLM provider",
      "classification": "identical",
      "action": "MATCH",
      "notes": "Both support provider flag with env var"
    },
    {
      "name": "model",
      "short": null,
      "takes_value": true,
      "optional_value": false,
      "default_value": null,
      "env_var": "RECUR_AGENT_MODEL",
      "description": "Model ID",
      "classification": "identical",
      "action": "MATCH",
      "notes": "Both support model flag with env var"
    },
    {
      "name": "api-key",
      "short": null,
      "takes_value": true,
      "optional_value": false,
      "default_value": null,
      "env_var": null,
      "description": "API key override",
      "classification": "identical",
      "action": "MATCH",
      "notes": "Both support api-key flag"
    },
    {
      "name": "system-prompt",
      "short": null,
      "takes_value": true,
      "optional_value": false,
      "default_value": null,
      "env_var": null,
      "description": "Override system prompt",
      "classification": "identical",
      "action": "MATCH",
      "notes": "Both support system-prompt flag"
    },
    {
      "name": "append-system-prompt",
      "short": null,
      "takes_value": true,
      "optional_value": false,
      "default_value": null,
      "env_var": null,
      "description": "Append to system prompt",
      "classification": "identical",
      "action": "MATCH",
      "notes": "Both support append-system-prompt flag"
    },
    {
      "name": "mode",
      "short": null,
      "takes_value": true,
      "optional_value": false,
      "default_value": null,
      "env_var": null,
      "description": "Output mode for print mode",
      "classification": "identical",
      "action": "MATCH",
      "notes": "Both support mode flag"
    },
    {
      "name": "print",
      "short": "p",
      "takes_value": false,
      "optional_value": false,
      "default_value": null,
      "env_var": null,
      "description": "Non-interactive mode",
      "classification": "identical",
      "action": "MATCH",
      "notes": "Both support print flag"
    },
    {
      "name": "continue",
      "short": "c",
      "takes_value": false,
      "optional_value": false,
      "default_value": null,
      "env_var": null,
      "description": "Continue previous session",
      "classification": "identical",
      "action": "MATCH",
      "notes": "Both support continue flag"
    },
    {
      "name": "resume",
      "short": "r",
      "takes_value": false,
      "optional_value": false,
      "default_value": null,
      "env_var": null,
      "description": "Select session from picker",
      "classification": "identical",
      "action": "MATCH",
      "notes": "Both support resume flag"
    },
    {
      "name": "session",
      "short": null,
      "takes_value": true,
      "optional_value": false,
      "default_value": null,
      "env_var": null,
      "description": "Use specific session file path",
      "classification": "identical",
      "action": "MATCH",
      "notes": "Both support session flag"
    },
    {
      "name": "session-dir",
      "short": null,
      "takes_value": true,
      "optional_value": false,
      "default_value": null,
      "env_var": null,
      "description": "Directory for session storage",
      "classification": "identical",
      "action": "MATCH",
      "notes": "Both support session-dir flag"
    },
    {
      "name": "no-session",
      "short": null,
      "takes_value": false,
      "optional_value": false,
      "default_value": null,
      "env_var": null,
      "description": "Don't save session",
      "classification": "identical",
      "action": "MATCH",
      "notes": "Both support no-session flag"
    },
    {
      "name": "models",
      "short": null,
      "takes_value": true,
      "optional_value": false,
      "default_value": null,
      "env_var": null,
      "description": "Model patterns for cycling",
      "classification": "identical",
      "action": "MATCH",
      "notes": "Both support models flag"
    },
    {
      "name": "thinking",
      "short": null,
      "takes_value": true,
      "optional_value": false,
      "default_value": null,
      "env_var": null,
      "description": "Extended thinking level",
      "classification": "identical",
      "action": "MATCH",
      "notes": "Both support thinking flag"
    },
    {
      "name": "no-tools",
      "short": null,
      "takes_value": false,
      "optional_value": false,
      "default_value": null,
      "env_var": null,
      "description": "Disable all built-in tools",
      "classification": "identical",
      "action": "MATCH",
      "notes": "Both support no-tools flag"
    },
    {
      "name": "tools",
      "short": null,
      "takes_value": true,
      "optional_value": false,
      "default_value": "read,bash,edit,write,grep,find,ls,hashline_edit",
      "env_var": null,
      "description": "Specific tools to enable",
      "classification": "identical",
      "action": "MATCH",
      "notes": "Both support tools flag"
    },
    {
      "name": "extension",
      "short": "e",
      "takes_value": true,
      "optional_value": false,
      "default_value": null,
      "env_var": null,
      "description": "Load extension file",
      "classification": "identical",
      "action": "MATCH",
      "notes": "Both support extension flag with multiple values"
    },
    {
      "name": "no-extensions",
      "short": null,
      "takes_value": false,
      "optional_value": false,
      "default_value": null,
      "env_var": null,
      "description": "Disable extension discovery",
      "classification": "identical",
      "action": "MATCH",
      "notes": "Both support no-extensions flag"
    },
    {
      "name": "skill",
      "short": null,
      "takes_value": true,
      "optional_value": false,
      "default_value": null,
      "env_var": null,
      "description": "Load skill file/directory",
      "classification": "identical",
      "action": "MATCH",
      "notes": "Both support skill flag"
    },
    {
      "name": "no-skills",
      "short": null,
      "takes_value": false,
      "optional_value": false,
      "default_value": null,
      "env_var": null,
      "description": "Disable skill discovery and configured skills (explicit --skill paths still load)",
      "classification": "identical",
      "action": "MATCH",
      "notes": "Both support no-skills flag"
    },
    {
      "name": "no-context-files",
      "short": null,
      "takes_value": false,
      "optional_value": false,
      "default_value": null,
      "env_var": "RECUR_AGENT_NO_CONTEXT_FILES",
      "description": "Disable AGENTS.md / CLAUDE.md discovery and loading",
      "classification": "identical",
      "action": "MATCH",
      "notes": "Both support no-context-files flag (gh #216); upstream also accepts -nc"
    },
    {
      "name": "prompt-template",
      "short": null,
      "takes_value": true,
      "optional_value": false,
      "default_value": null,
      "env_var": null,
      "description": "Load prompt template",
      "classification": "identical",
      "action": "MATCH",
      "notes": "Both support prompt-template flag"
    },
    {
      "name": "no-prompt-templates",
      "short": null,
      "takes_value": false,
      "optional_value": false,
      "default_value": null,
      "env_var": null,
      "description": "Disable prompt template discovery",
      "classification": "identical",
      "action": "MATCH",
      "notes": "Both support no-prompt-templates flag"
    },
    {
      "name": "theme",
      "short": null,
      "takes_value": true,
      "optional_value": false,
      "default_value": null,
      "env_var": null,
      "description": "Select active theme",
      "classification": "identical",
      "action": "MATCH",
      "notes": "Both support theme flag"
    },
    {
      "name": "no-themes",
      "short": null,
      "takes_value": false,
      "optional_value": false,
      "default_value": null,
      "env_var": null,
      "description": "Disable theme discovery",
      "classification": "identical",
      "action": "MATCH",
      "notes": "Both support no-themes flag"
    },
    {
      "name": "export",
      "short": null,
      "takes_value": true,
      "optional_value": false,
      "default_value": null,
      "env_var": null,
      "description": "Export session file to HTML",
      "classification": "identical",
      "action": "MATCH",
      "notes": "Both support export flag"
    },
    {
      "name": "list-models",
      "short": null,
      "takes_value": true,
      "optional_value": true,
      "default_value": null,
      "env_var": null,
      "description": "List available models",
      "classification": "identical",
      "action": "MATCH",